{
  "$schema": "https://json-schema.org/draft/2020-12/schema",
  "$id": "https://ag-digitalz.local/schemas/project.schema.json",
  "title": "AG Digitalz OS Project",
  "type": "object",
  "additionalProperties": false,
  "required": [
    "id",
    "name",
    "status",
    "owner",
    "projectType",
    "managementMode",
    "goal",
    "scope",
    "outOfScope",
    "trustLevel",
    "stack",
    "risks",
    "approvalRequiredFor",
    "qualityGates",
    "securityReview",
    "costTracking",
    "deploymentPlan",
    "createdAt",
    "updatedAt"
  ],
  "properties": {
    "template": { "type": "boolean", "const": true },
    "id": { "type": "string", "pattern": "^project-[a-z0-9-]+$" },
    "name": { "type": "string", "minLength": 3 },
    "status": { "type": "string", "enum": ["idea", "planned", "active", "blocked", "paused", "complete", "archived"] },
    "owner": { "type": "string", "minLength": 1 },
    "projectType": { "type": "string", "enum": ["internal_project", "product_project", "ag_os_core"] },
    "managementMode": {
      "type": "string",
      "enum": ["observe_only", "read_only", "active_build", "managed_staging", "production_managed"]
    },
    "goal": { "type": "string", "minLength": 1 },
    "knownFacts": { "type": "array", "items": { "type": "string" }, "minItems": 1 },
    "scope": { "type": "array", "items": { "type": "string" }, "minItems": 1 },
    "outOfScope": { "type": "array", "items": { "type": "string" }, "minItems": 1 },
    "trustLevel": { "type": "integer", "minimum": 0, "maximum": 4 },
    "stack": { "type": "array", "items": { "type": "string" }, "minItems": 1 },
    "risks": {
      "type": "array",
      "items": {
        "type": "object",
        "additionalProperties": false,
        "required": ["risk", "mitigation"],
        "properties": {
          "risk": { "type": "string", "minLength": 1 },
          "mitigation": { "type": "string", "minLength": 1 }
        }
      }
    },
    "approvalRequiredFor": { "type": "array", "items": { "type": "string" } },
    "qualityGates": { "type": "array", "items": { "type": "string" } },
    "securityReview": { "type": "string", "minLength": 1 },
    "costTracking": { "type": "string", "minLength": 1 },
    "deploymentPlan": { "type": "string", "minLength": 1 },
    "createdAt": { "type": "string", "format": "date-time" },
    "updatedAt": { "type": "string", "format": "date-time" }
  }
}
